{
  "schema": "chatgpt_lab.github_thread_fixture.v1",
  "kind": "issue",
  "number": 2,
  "title": "Goal change must route to goal guardian",
  "author": "grahama1970",
  "labels": [
    "agent-work",
    "next:human"
  ],
  "body": "Initial issue body for goal-change route parsing.",
  "comments": [
    {
      "id": 2001,
      "author": "grahama1970",
      "author_association": "OWNER",
      "created_at": "2026-06-27T00:00:00Z",
      "body": "```json\n{\n  \"schema\": \"chatgpt_lab.human_interjection.v1\",\n  \"authority\": \"human\",\n  \"channel\": \"github\",\n  \"goal\": {\n    \"goal_id\": \"goal-2026-06-greenfield-001\",\n    \"current_goal_version\": 1,\n    \"current_goal_hash\": \"sha256:607ad418a0ccc0499b8b069225794d51f3a5e985825e5ef324bcba0df2c555a5\",\n    \"goal_action\": \"create_new_version\"\n  },\n  \"decision\": {\n    \"type\": \"course_correct\",\n    \"summary\": \"Create a new goal version after guardian review.\",\n    \"rationale\": \"Goal changes must be reconciled before work continues.\"\n  },\n  \"new_goal_version\": {\n    \"proposed_version\": 2\n  },\n  \"course_correction\": {\n    \"what_changes\": \"A new goal version is proposed.\",\n    \"what_does_not_change\": \"No agent may apply the goal version without validation.\",\n    \"non_goals\": []\n  },\n  \"next\": {\n    \"subagent\": \"goal-guardian\",\n    \"executor\": \"either\",\n    \"reason\": \"Goal changes must route through goal guardian.\",\n    \"labels\": [\"agent-work\", \"next:goal-guardian\", \"executor:either\"]\n  },\n  \"github\": {\n    \"target\": {\"repository\": \"grahama1970/chatgpt-lab\", \"kind\": \"issue\", \"number\": 2},\n    \"create\": null,\n    \"comment\": {\"body\": \"Human interjection proposes a goal change and routes to goal guardian.\"},\n    \"labels\": {\"add\": [\"agent-work\", \"next:goal-guardian\", \"executor:either\"], \"remove\": [\"next:human\"]}\n  },\n  \"required_evidence\": [\"goal guardian decision\"],\n  \"stop_condition\": \"Goal guardian posts a schema-valid reconciliation decision.\"\n}\n```"
    }
  ],
  "expected_decision": {
    "status": "ROUTE",
    "next_subagent": "goal-guardian"
  }
}
