{
  "schema": "chatgpt_lab.github_thread_fixture.v1",
  "kind": "issue",
  "number": 1,
  "title": "Goal-locked harness test issue",
  "author": "grahama1970",
  "labels": [
    "agent-work",
    "next:human"
  ],
  "body": "Initial issue body for dry-run route parsing.",
  "comments": [
    {
      "id": 1001,
      "author": "grahama1970",
      "author_association": "OWNER",
      "created_at": "2026-06-27T00:00:00Z",
      "body": "```json\n{\n  \"schema\": \"chatgpt_lab.human_interjection.v1\",\n  \"authority\": \"human\",\n  \"channel\": \"github\",\n  \"goal\": {\n    \"goal_id\": \"goal-2026-06-greenfield-001\",\n    \"current_goal_version\": 1,\n    \"current_goal_hash\": \"sha256:607ad418a0ccc0499b8b069225794d51f3a5e985825e5ef324bcba0df2c555a5\",\n    \"goal_action\": \"preserve\"\n  },\n  \"decision\": {\n    \"type\": \"route_ticket\",\n    \"summary\": \"Route this issue to the reviewer for dry-run validation.\",\n    \"rationale\": \"The human is preserving the active goal and selecting the next bounded subagent.\"\n  },\n  \"new_goal_version\": null,\n  \"course_correction\": {\n    \"what_changes\": \"Route to reviewer.\",\n    \"what_does_not_change\": \"The immutable goal and success criteria remain unchanged.\",\n    \"non_goals\": []\n  },\n  \"next\": {\n    \"subagent\": \"reviewer\",\n    \"executor\": \"either\",\n    \"reason\": \"Reviewer should inspect the dry-run contract evidence.\",\n    \"labels\": [\"agent-work\", \"next:reviewer\", \"executor:either\"]\n  },\n  \"github\": {\n    \"target\": {\"repository\": \"grahama1970/chatgpt-lab\", \"kind\": \"issue\", \"number\": 1},\n    \"create\": null,\n    \"comment\": {\"body\": \"Human interjection routes issue #1 to reviewer.\"},\n    \"labels\": {\"add\": [\"agent-work\", \"next:reviewer\", \"executor:either\"], \"remove\": [\"next:human\"]}\n  },\n  \"required_evidence\": [\"route decision JSON\"],\n  \"stop_condition\": \"Dry-run route parser emits ROUTE to reviewer.\"\n}\n```"
    }
  ],
  "expected_decision": {
    "status": "ROUTE",
    "next_subagent": "reviewer"
  }
}
